{
  "$schema": "./compatibility.schema.json",
  "schemaVersion": "1.0",
  "_": "Support matrix ของ kit (EV-007) · newest release อยู่บนสุดเสมอ · scripts/check-compatibility.js บังคับให้ตรงกับ package.json และ schemas/registry.json · อธิบายที่ standards/release-policy.md",
  "releases": [
    {
      "version": "3.20.0",
      "releasedAt": "2026-10-05",
      "change": "minor",
      "summary": "mergeMode in .claude/stack.json chooses how work reaches main: direct (the AI squash-merges and pushes after /check, the pre-push gate is the check; new installs get it) or pr (a human merges a PR). An unset key reads as pr, so installed projects behave as before. stack-config 1.1 adds the optional field; 1.0 is still read.",
      "reads": {
        "stack-config": [
          "1.0",
          "1.1"
        ],
        "readiness-manifest": [
          "1.0"
        ],
        "prototype-flow": [
          "1.0"
        ],
        "pixel-config": [
          "1.0"
        ],
        "project-manifest": [
          "1.0"
        ],
        "product-graph": [
          "1.0"
        ],
        "application-profile": [
          "1.0",
          "1.1"
        ],
        "pack": [
          "2.0"
        ],
        "evidence-bundle": [
          "1.0"
        ],
        "failure-record": [
          "1.0"
        ],
        "requirement-coverage": [
          "1.0"
        ],
        "security-baseline": [
          "1.0"
        ],
        "supply-chain": [
          "1.0"
        ],
        "operational-readiness": [
          "1.0"
        ],
        "budget-evidence": [
          "1.0"
        ],
        "eval-case": [
          "1.0"
        ],
        "eval-run": [
          "1.0"
        ],
        "assumption-ledger": [
          "1.0"
        ],
        "change-proposal": [
          "1.0"
        ]
      }
    },
    {
      "version": "3.19.1",
      "releasedAt": "2026-09-28",
      "change": "patch",
      "summary": "A push that only deletes refs skips the gate in the pre-push template (projects copy it by hand; buaflow upgrade names the step). guard-bash reads flags, not commit message text, and now blocks a quoted main. guard-edit lets a new test file through on a bug-fix branch. No schema changes and no control file changes.",
      "reads": {
        "stack-config": [
          "1.0"
        ],
        "readiness-manifest": [
          "1.0"
        ],
        "prototype-flow": [
          "1.0"
        ],
        "pixel-config": [
          "1.0"
        ],
        "project-manifest": [
          "1.0"
        ],
        "product-graph": [
          "1.0"
        ],
        "application-profile": [
          "1.0",
          "1.1"
        ],
        "pack": [
          "2.0"
        ],
        "evidence-bundle": [
          "1.0"
        ],
        "failure-record": [
          "1.0"
        ],
        "requirement-coverage": [
          "1.0"
        ],
        "security-baseline": [
          "1.0"
        ],
        "supply-chain": [
          "1.0"
        ],
        "operational-readiness": [
          "1.0"
        ],
        "budget-evidence": [
          "1.0"
        ],
        "eval-case": [
          "1.0"
        ],
        "eval-run": [
          "1.0"
        ],
        "assumption-ledger": [
          "1.0"
        ],
        "change-proposal": [
          "1.0"
        ]
      }
    },
    {
      "version": "3.19.0",
      "releasedAt": "2026-09-26",
      "change": "minor",
      "summary": "Kit files stay verbatim. install overwrites without asking only content some kit release shipped; content a lock accepted but no release shipped (a formatter's rewrite, possibly hiding a real edit) is a conflict. A project that uses prettier gets the files install copies added to .prettierignore, doctor warns when they are not, and buaflow upgrade reports it. No schema changes and no control file changes.",
      "reads": {
        "stack-config": [
          "1.0"
        ],
        "readiness-manifest": [
          "1.0"
        ],
        "prototype-flow": [
          "1.0"
        ],
        "pixel-config": [
          "1.0"
        ],
        "project-manifest": [
          "1.0"
        ],
        "product-graph": [
          "1.0"
        ],
        "application-profile": [
          "1.0",
          "1.1"
        ],
        "pack": [
          "2.0"
        ],
        "evidence-bundle": [
          "1.0"
        ],
        "failure-record": [
          "1.0"
        ],
        "requirement-coverage": [
          "1.0"
        ],
        "security-baseline": [
          "1.0"
        ],
        "supply-chain": [
          "1.0"
        ],
        "operational-readiness": [
          "1.0"
        ],
        "budget-evidence": [
          "1.0"
        ],
        "eval-case": [
          "1.0"
        ],
        "eval-run": [
          "1.0"
        ],
        "assumption-ledger": [
          "1.0"
        ],
        "change-proposal": [
          "1.0"
        ]
      }
    },
    {
      "version": "3.18.0",
      "releasedAt": "2026-09-26",
      "change": "minor",
      "summary": "Upgrading is one command and one report: buaflow upgrade decides from the project's files the installed version, the route, what each file becomes, the manual steps that apply and which .claude/ copies the plugin replaces, and /buaflow:upgrade works from it while /buaflow:start only starts and resumes. claude-setup/kit-history.json ships every content the kit ever installed, so a project with no lock upgraded from the plugin cache (not a git checkout) no longer sees old kit files as conflicts. No schema changes and no project file has to change by hand.",
      "reads": {
        "stack-config": [
          "1.0"
        ],
        "readiness-manifest": [
          "1.0"
        ],
        "prototype-flow": [
          "1.0"
        ],
        "pixel-config": [
          "1.0"
        ],
        "project-manifest": [
          "1.0"
        ],
        "product-graph": [
          "1.0"
        ],
        "application-profile": [
          "1.0",
          "1.1"
        ],
        "pack": [
          "2.0"
        ],
        "evidence-bundle": [
          "1.0"
        ],
        "failure-record": [
          "1.0"
        ],
        "requirement-coverage": [
          "1.0"
        ],
        "security-baseline": [
          "1.0"
        ],
        "supply-chain": [
          "1.0"
        ],
        "operational-readiness": [
          "1.0"
        ],
        "budget-evidence": [
          "1.0"
        ],
        "eval-case": [
          "1.0"
        ],
        "eval-run": [
          "1.0"
        ],
        "assumption-ledger": [
          "1.0"
        ],
        "change-proposal": [
          "1.0"
        ]
      }
    },
    {
      "version": "3.17.1",
      "releasedAt": "2026-09-26",
      "change": "patch",
      "summary": "docs-lint accepts a task whose intent:, spec: or plan: names several files, as `a, b` or `[a, b]`, and fails only when one of them is missing, naming just that one. Before, the whole value was checked as a single path, so a task that grew out of two intents failed the gate although both files existed; a multi-folder spec: skipped the [NEEDS CLARIFICATION] check and a multi-file plan: crashed docs-lint. No schema changes and no project file has to change by hand.",
      "reads": {
        "stack-config": [
          "1.0"
        ],
        "readiness-manifest": [
          "1.0"
        ],
        "prototype-flow": [
          "1.0"
        ],
        "pixel-config": [
          "1.0"
        ],
        "project-manifest": [
          "1.0"
        ],
        "product-graph": [
          "1.0"
        ],
        "application-profile": [
          "1.0",
          "1.1"
        ],
        "pack": [
          "2.0"
        ],
        "evidence-bundle": [
          "1.0"
        ],
        "failure-record": [
          "1.0"
        ],
        "requirement-coverage": [
          "1.0"
        ],
        "security-baseline": [
          "1.0"
        ],
        "supply-chain": [
          "1.0"
        ],
        "operational-readiness": [
          "1.0"
        ],
        "budget-evidence": [
          "1.0"
        ],
        "eval-case": [
          "1.0"
        ],
        "eval-run": [
          "1.0"
        ],
        "assumption-ledger": [
          "1.0"
        ],
        "change-proposal": [
          "1.0"
        ]
      }
    },
    {
      "version": "3.17.0",
      "releasedAt": "2026-09-26",
      "change": "minor",
      "summary": "Tasks split for parallel work stop colliding on the same files (BC-008). A task declares the files it expects to change as touches:; /spec marks [P] only on tasks with no depends_on between them and no file in common; /task compares touches: with the files open PRs change before the claim; /check and /done merge origin/main into the branch before review and before the PR is marked ready, and /done names the open PRs that share files with what just merged. docs-lint warns, never fails, when two open tasks share a touches: path with no depends_on chain between them. No schema changes and no project file has to change by hand.",
      "reads": {
        "stack-config": [
          "1.0"
        ],
        "readiness-manifest": [
          "1.0"
        ],
        "prototype-flow": [
          "1.0"
        ],
        "pixel-config": [
          "1.0"
        ],
        "project-manifest": [
          "1.0"
        ],
        "product-graph": [
          "1.0"
        ],
        "application-profile": [
          "1.0",
          "1.1"
        ],
        "pack": [
          "2.0"
        ],
        "evidence-bundle": [
          "1.0"
        ],
        "failure-record": [
          "1.0"
        ],
        "requirement-coverage": [
          "1.0"
        ],
        "security-baseline": [
          "1.0"
        ],
        "supply-chain": [
          "1.0"
        ],
        "operational-readiness": [
          "1.0"
        ],